{
  "schema_version": 1,
  "analyser_version": "2026.05.03-1",
  "model_id": "composer-2",
  "target_id": "skill:zoto-create-evals",
  "kind": "skill",
  "source_path": "plugins/zoto-eval-system/skills/zoto-create-evals/SKILL.md",
  "source_hash": "2ac11a420c0e8a817c86f7d7f00ccf58e1b17c825ca571984dd09e385ae82fed",
  "summary": "Covers the dual-backend scaffold path with discovery, manifest writes, package merge, validation gates, ignore-driven skips, and guardrails around interactive prompts and env template handling.",
  "cases": [
    {
      "scenario": "dual-backend scaffold with discovery manifests validation",
      "prompt": "We already ran `/z-eval-create` and approved every discovered command, agent, and hook target plus the proprietary skills; proceed with the create-evals workflow now so `pnpm run eval:list`, static collection, and LLM harness wiring land together.",
      "expected_output": "Final report lists stamped pytest + agent-sdk `_llm` trees under the configured eval directory, refreshed `package.json` scripts and devDependencies including dotenv, new `.zoto/eval-system/manifest.yml` matching an appended `manifest.history.yml` snapshot, per-command/agent/hook JSON rows under both plugin and `.cursor/evals` roots with `_meta.generated: true`, templated per-skill `evals/evals.json` files from `templates/skill-evals/evals.json.tmpl` for each approved skill directory, explicit passes for `pnpm run eval:list`, `pnpm run eval -- --collect-only`, and `pnpm run eval:update --check`, a reminder to install packages once, and notes that only `hook:cursor-workspace` should be targeted while legacy `hook:cursor` stays deprecated.",
      "assertions": [
        "Before stamping templates, the agent dispatched `pnpm run eval:discover` (via an explore subagent) and reconciled the Task-approved ID list with `config.ignore` minimatches without calling `askQuestion`.",
        "`templates/static/pytest/*` landed under `{evalsDir}/`, `templates/llm/agent-sdk/*` under `{evalsDir}/_llm/`, `templates/runner/test.py.tmpl` became `scripts/test.py`, and `templates/schema/result.schema.json` copied beside the LLM harness.",
        "`static.framework`, `llm.strategy`, and `llm.codeFramework` selections read from `.zoto/eval-system/config.yml` governed which pytest versus Vitest or Jest bundles were emitted without silent framework drift.",
        "Only command, agent, and hook targets received `pnpm run eval:analyse -- …` followed by `pnpm run eval:stamp -- …`; skill targets consumed `templates/skill-evals/evals.json.tmpl` locally without central `eval-stamp.ts` runs.",
        "`pnpm exec tsx scripts/package-json-merger.ts` merged `templates/package-scripts/base.json` without touching unrelated host sources outside the documented allow-list.",
        "`manifest.yml` and the appended `manifest.history.yml` entry share identical YAML payloads including `schema_version`, timestamps, `git_ref`, `generated_by: zoto-create-evals`, and populated `targets[].eval_files`.",
        "No `.env` file was created; if `.env.example` pre-existed the report calls out verifying `CURSOR_API_KEY` coverage instead of rewriting the file.",
        "Optional hygiene instructions mention running `pnpm exec tsx scripts/eval-cleanup-vendored.ts` after tightening `ignore[]` so vendored-only fixtures disappear.",
        "When cleanup tooling encounters mixed authored and generated rows inside the same eval asset, the workflow surfaces `needs_user_input` instead of deleting anything automatically."
      ]
    },
    {
      "scenario": "needs_user_input when evaluation config missing",
      "prompt": "Spin up the eval suite from `/z-eval-create` immediately—this workspace still lacks `.zoto/eval-system/config.yml`, so finish provisioning via the skill.",
      "expected_output": "Structured `needs_user_input` tells the operator run `/z-eval-configure` first, explicitly citing the absent config path; no template directories were stamped yet.",
      "assertions": [
        "The response returns `needs_user_input` describing that `.zoto/eval-system/config.yml` must exist before scaffolding.",
        "No `askQuestion` hooks fired from the skill loop.",
        "No writes occurred under `{evalsDir}/`, `.zoto/eval-system/manifest.yml`, or `manifest.history.yml`."
      ]
    },
    {
      "scenario": "ignore minimatches skip analyse stamp cleanly",
      "prompt": "Approved IDs include `command:upstream-docs` but its canonical Markdown sits under `upstream-vendor/commands/upstream-docs.md` matched by `config.ignore`; run create-evals now.",
      "fixtures": {
        "files": [
          {
            "path": "workspace/.zoto/eval-system/config.yml",
            "content": "schema_version: 2\nstatic:\n  framework: pytest\nllm:\n  strategy: code\n  codeFramework: vitest\nevalsDir: evals\nignore:\n  - \"upstream-vendor/**\"\nmanualChecklists:\n  enabled: false\n"
          }
        ]
      },
      "fixture_justifications": [
        "Provides realistic `ignore` globs so minimatched targets exit analyse/stamp with `{ ignored: true }` without touching forbidden paths."
      ],
      "expected_output": "Report confirms skipped IDs honour minimatches, documents matching globs, and reminds operators to run `pnpm exec tsx scripts/eval-cleanup-vendored.ts` once ignores ship.",
      "assertions": [
        "`pnpm run eval:analyse -- command:upstream-docs` (when accidentally invoked) exits reporting `{ ignored: true, matched_glob }` and emits no new JSON under `.cursor/evals/commands/`.",
        "`pnpm run eval:stamp -- command:upstream-docs` likewise refuses writes for ignored sources.",
        "Other approved targets still receive analyse/stamp cycles after filtering."
      ]
    },
    {
      "scenario": "repository env template remains untouched when present",
      "prompt": "Approved checklist matches defaults—finish create-evals while respecting existing secrets guidance files.",
      "fixtures": {
        "files": [
          {
            "path": "workspace/.env.example",
            "content": "# host-managed secrets\nCURSOR_API_KEY=\nCUSTOM_CI_SECRET=\n"
          }
        ]
      },
      "fixture_justifications": [
        "Forces the skill to skip overwriting `.env.example` yet surface an explicit reminder about `CURSOR_API_KEY` coverage."
      ],
      "expected_output": "`.env.example` bytes remain identical while the report highlights verifying `CURSOR_API_KEY` entries manually.",
      "assertions": [
        "SHA256 of `.env.example` stayed unchanged relative to the pre-run workspace overlay.",
        "Final narration mentions reconciling `CURSOR_API_KEY` without rewriting the env template file.",
        "`.env` was not introduced anywhere in the repo."
      ]
    },
    {
      "scenario": "manual checklist template copied when enabled",
      "prompt": "Operator toggled manual checklist generation—complete `/z-eval-create` after approvals.",
      "fixtures": {
        "files": [
          {
            "path": "workspace/.zoto/eval-system/config.yml",
            "content": "schema_version: 2\nstatic:\n  framework: pytest\nllm:\n  strategy: code\n  codeFramework: vitest\nevalsDir: evals\nignore: []\nmanualChecklists:\n  enabled: true\n"
          }
        ]
      },
      "fixture_justifications": [
        "Turns on `manualChecklists.enabled` so `{evalsDir}/USER_EVAL_CHECKLISTS.md` must materialise from `templates/user-checklists/USER_EVAL_CHECKLISTS.md.tmpl`."
      ],
      "expected_output": "`{evalsDir}/USER_EVAL_CHECKLISTS.md` exists with templated sections operators can annotate during review.",
      "assertions": [
        "`templates/user-checklists/USER_EVAL_CHECKLISTS.md.tmpl` copied into `{evalsDir}/USER_EVAL_CHECKLISTS.md` when `manualChecklists.enabled` is true.",
        "Other scaffolding steps still completed plus validation commands succeeded.",
        "`askQuestion` remained unused inside the skill execution."
      ]
    }
  ]
}
